{
  "name": "VinuChain",
  "website": "https://vinuchain.com",
  "description": "VinuChain core protocol contracts — Special Fee Contract (SFC) for validator staking, NodeDriver/NodeDriverAuth governance, and Quota/Payback contracts backing fee refunds",
  "contact": "hello@vinuchain.com",
  "security": "hello@vinuchain.com",
  "contracts": [
    {
      "name": "SFC",
      "address": "0xFC00FACE00000000000000000000000000000000",
      "type": "staking",
      "chainId": 207,
      "description": "Special Fee Contract — manages validator creation, stake delegation, epoch rewards, lockups, and slashing",
      "codeHash": "0x29b88152209fe22bef409376aa7f137d0e0f571f46afa1385f32320765e49e50"
    },
    {
      "name": "NodeDriverAuth",
      "address": "0xD100ae0000000000000000000000000000000000",
      "type": "system",
      "chainId": 207,
      "description": "Owner-controlled governance contract for network administration — queues and executes time-locked migrations, network rule updates, epoch advances, and nonce increments",
      "codeHash": "0x697a57bb41f56573acb3a2fa00676e9dc7a8b5a5c17a2ddbe56a8a2bada481c5"
    },
    {
      "name": "NodeDriver",
      "address": "0xd100A01E00000000000000000000000000000000",
      "type": "system",
      "chainId": 207,
      "description": "EVM-facing relay contract between NodeDriverAuth and the EvmWriter precompile — emits canonical events for validator weight/pubkey changes, network rule updates, and epoch advances",
      "codeHash": "0xf8d8f32cbea10ec751984b6caca46ea99c76a51362bc51851bc0d773b855f03b"
    },
    {
      "name": "OptimizedTransparentUpgradeableProxy",
      "address": "0x824B93dE7221cf8a35FBd29d5202f6eFa3A29C5D",
      "type": "staking",
      "chainId": 206,
      "description": "Legacy testnet Quota/Payback EIP-1967 proxy kept for historical transactions. PaybackV2 switched active quota accounting to the non-proxy QuotaContractV2 entry on 2026-05-16.",
      "codeHash": "0x1e71c4a5b01c61a4b1a4afa98257a085e472bfc63a362efa77be9a23e714cdc9",
      "implCodeHash": "0x73711ebcc33887dd6ce29edfb3e1eaa97e72e5abde5510685246083e337d3b8d"
    },
    {
      "name": "QuotaContract",
      "address": "0x0c8735bD6b3E90eaD4cdAB917474Cc6e8E58ce82",
      "type": "staking",
      "chainId": 206,
      "description": "Historical verified pre-PaybackV2 Quota/Payback implementation behind the legacy testnet proxy. Active testnet payback now uses QuotaContractV2.",
      "codeHash": "0x73711ebcc33887dd6ce29edfb3e1eaa97e72e5abde5510685246083e337d3b8d"
    },
    {
      "name": "QuotaContractV2",
      "artifact": "QuotaContractV2",
      "address": "0x89D1cBD9DEAaB4dFf6f800a336FBDd9A5c6829e4",
      "type": "staking",
      "chainId": 206,
      "description": "Active testnet PaybackV2 non-proxy contract. stakeFor(address) credits receiver refunds; funding wallet owns/withdraws stake via unstakeFor(address,uint256). Deployed 2026-05-16.",
      "codeHash": "0x77c89af1920577cf6cd79da4281b20ac94cd1e262c1b53ccb1f968d77442e95e"
    },
    {
      "name": "QuotaContractV2",
      "artifact": "QuotaContractV2",
      "address": "0x5D989A2d65d049e2198D91d8ddc31C918f2544AB",
      "type": "staking",
      "chainId": 207,
      "description": "Mainnet PaybackV2 non-proxy contract, deployed 2026-08-21. Replaces the Quota proxy 0x1c4269fb...0acda6 (ProxyAdmin key lost). Params mirror V1. Load-bearing only after the ELEMONT seal rebinds.",
      "codeHash": "0x6e8935d60f28814c2feff1b076d8225cde134bfd2ed7ac467b31e9a69838c649"
    }
  ],
  "social": {
    "github": "https://github.com/VinuChain",
    "twitter": "https://x.com/vinuchain",
    "telegram": "https://t.me/vinuchain",
    "discord": "https://discord.gg/vinu"
  },
  "related_registries": [
    {
      "name": "VinuChain Name Service",
      "path": "../vns",
      "network": "testnet-206",
      "summary": "ENS v1.7.0 port for the .vinu TLD. Live on testnet only; mainnet rollout is gated on Root.lock(vinu), owner-key split, mainnet deployment, and explorer multi-chain support. See ../vns/deployment-testnet.json for active addresses."
    }
  ]
}
